{
    "$schema": "http://json-schema.org/draft-07/schema#",
    "additionalProperties": false,
    "type": "object",
    "properties": {
        "$schema": {
            "type": "string"
        },
        "app.title": {
            "type": "string"
        },
        "form.buttons.cancel": {
            "type": "string"
        },
        "form.buttons.save": {
            "type": "string"
        },
        "form.validation.email": {
            "type": "string"
        },
        "form.validation.required": {
            "type": "string"
        },
        "nav.about": {
            "type": "string"
        },
        "nav.home": {
            "type": "string"
        },
        "tasks.count": {
            "type": "string"
        },
        "user.greeting": {
            "type": "string"
        },
        "user.welcome": {
            "type": "string"
        }
    },
    "patternProperties": {
        "^[a-zA-Z_]+(\\.[a-zA-Z0-9_-]+)*$": {
            "type": "string"
        }
    },
    "required": [
        "$schema",
        "app.title",
        "form.buttons.cancel",
        "form.buttons.save",
        "form.validation.email",
        "form.validation.required",
        "nav.about",
        "nav.home",
        "tasks.count",
        "user.greeting",
        "user.welcome"
    ]
}